{
  "version": 1,
  "brand": {
    "name": "VectorKit",
    "category": "AI developer platform",
    "audience": "Engineering teams building reliable agent workflows",
    "attributes": [
      "precise",
      "technical",
      "calm",
      "modular",
      "trustworthy"
    ],
    "colors": {
      "background": "#ffffff",
      "foreground": "#111111",
      "accent": "#2563eb",
      "preferred": [
        "#111111",
        "#ffffff",
        "#2563eb"
      ],
      "forbidden": [
        "generic AI sparkle gradients"
      ]
    },
    "constraints": [
      "must work in black and white",
      "must read at favicon size",
      "avoid mascots"
    ]
  },
  "summary": "A sample Logo Lab gallery for VectorKit, an AI developer platform that needs a precise, modular, high-contrast identity system.",
  "directions": [
    {
      "id": "signal-systems",
      "name": "Signal Systems",
      "description": "Linear and striped marks that suggest reliable signal, routing, and agent coordination.",
      "conceptIds": [
        "vectorkit-001",
        "vectorkit-002",
        "vectorkit-003",
        "vectorkit-004",
        "vectorkit-005",
        "vectorkit-041",
        "vectorkit-042",
        "vectorkit-043",
        "vectorkit-044",
        "vectorkit-045"
      ]
    },
    {
      "id": "precise-geometry",
      "name": "Precise Geometry",
      "description": "Radial and interlocking systems with a technical, engineered character.",
      "conceptIds": [
        "vectorkit-011",
        "vectorkit-012",
        "vectorkit-013",
        "vectorkit-014",
        "vectorkit-015",
        "vectorkit-036",
        "vectorkit-037",
        "vectorkit-038",
        "vectorkit-039",
        "vectorkit-040"
      ]
    },
    {
      "id": "platform-grid",
      "name": "Platform Grid",
      "description": "Modular grid marks that feel extensible, systematic, and product-native.",
      "conceptIds": [
        "vectorkit-021",
        "vectorkit-022",
        "vectorkit-023",
        "vectorkit-024",
        "vectorkit-025",
        "vectorkit-046",
        "vectorkit-047",
        "vectorkit-048",
        "vectorkit-049",
        "vectorkit-050"
      ]
    },
    {
      "id": "bold-containers",
      "name": "Bold Containers",
      "description": "Contained abstract marks with high recognition and strong app-icon potential.",
      "conceptIds": [
        "vectorkit-026",
        "vectorkit-027",
        "vectorkit-028",
        "vectorkit-029",
        "vectorkit-030",
        "vectorkit-031",
        "vectorkit-032",
        "vectorkit-033",
        "vectorkit-034",
        "vectorkit-035"
      ]
    },
    {
      "id": "letter-marks",
      "name": "Letter Marks",
      "description": "Initial-driven marks using V and K as compact product signatures.",
      "conceptIds": [
        "vectorkit-006",
        "vectorkit-007",
        "vectorkit-008",
        "vectorkit-009",
        "vectorkit-010",
        "vectorkit-016",
        "vectorkit-017",
        "vectorkit-018",
        "vectorkit-019",
        "vectorkit-020"
      ]
    }
  ],
  "concepts": [
    {
      "id": "vectorkit-001",
      "rank": 1,
      "directionId": "signal-systems",
      "sourceConceptId": "line-warp-0001",
      "sourceUrl": "https://natemodi.com/logo/line-warp/#v=1&r=1&seed=ivros3y7",
      "toolSlug": "line-warp",
      "toolName": "Line Warp",
      "url": "https://natemodi.com/logo/line-warp/#v=1&r=1&seed=ivros3y7&bg=111111&fg=ffffff",
      "embedUrl": "https://natemodi.com/logo/line-warp/#v=1&r=1&seed=ivros3y7&bg=111111&fg=ffffff",
      "colorsUsed": [
        "#111111",
        "#ffffff",
        "#2563eb"
      ],
      "variationType": "recolored-curated",
      "rationale": "Line Warp creates a controlled signal motif that fits reliable agent infrastructure without falling into generic AI symbols.",
      "bestFor": "agent orchestration, routing, and observability surfaces",
      "tags": [
        "signal-systems",
        "letter",
        "monogram",
        "linear",
        "topographic",
        "systematic"
      ],
      "isRecommended": true,
      "recommendationReason": "Strong silhouette, clear technical fit, and useful contrast as a system seed."
    },
    {
      "id": "vectorkit-002",
      "rank": 2,
      "directionId": "signal-systems",
      "sourceConceptId": "line-warp-0002",
      "sourceUrl": "https://natemodi.com/logo/line-warp/#v=1&r=1&seed=crbebkmw",
      "toolSlug": "line-warp",
      "toolName": "Line Warp",
      "url": "https://natemodi.com/logo/line-warp/#v=1&r=1&seed=crbebkmw&bg=ffffff&fg=111111",
      "embedUrl": "https://natemodi.com/logo/line-warp/#v=1&r=1&seed=crbebkmw&bg=ffffff&fg=111111",
      "colorsUsed": [
        "#ffffff",
        "#111111",
        "#2563eb"
      ],
      "variationType": "recolored-curated",
      "rationale": "Line Warp creates a controlled signal motif that fits reliable agent infrastructure without falling into generic AI symbols.",
      "bestFor": "agent orchestration, routing, and observability surfaces",
      "tags": [
        "signal-systems",
        "letter",
        "monogram",
        "linear",
        "topographic",
        "systematic"
      ],
      "isRecommended": true,
      "recommendationReason": "Strong silhouette, clear technical fit, and useful contrast as a system seed."
    },
    {
      "id": "vectorkit-003",
      "rank": 3,
      "directionId": "signal-systems",
      "sourceConceptId": "line-warp-0003",
      "sourceUrl": "https://natemodi.com/logo/line-warp/#v=1&r=1&seed=ipr1po3r",
      "toolSlug": "line-warp",
      "toolName": "Line Warp",
      "url": "https://natemodi.com/logo/line-warp/#v=1&r=1&seed=ipr1po3r&bg=111111&fg=ffffff",
      "embedUrl": "https://natemodi.com/logo/line-warp/#v=1&r=1&seed=ipr1po3r&bg=111111&fg=ffffff",
      "colorsUsed": [
        "#111111",
        "#ffffff",
        "#2563eb"
      ],
      "variationType": "lightly-varied-curated",
      "rationale": "Line Warp creates a controlled signal motif that fits reliable agent infrastructure without falling into generic AI symbols.",
      "bestFor": "agent orchestration, routing, and observability surfaces",
      "tags": [
        "signal-systems",
        "letter",
        "monogram",
        "linear",
        "topographic",
        "systematic"
      ],
      "isRecommended": true,
      "recommendationReason": "Strong silhouette, clear technical fit, and useful contrast as a system seed."
    },
    {
      "id": "vectorkit-004",
      "rank": 4,
      "directionId": "signal-systems",
      "sourceConceptId": "line-warp-0004",
      "sourceUrl": "https://natemodi.com/logo/line-warp/#v=1&r=1&seed=wkhph6ea",
      "toolSlug": "line-warp",
      "toolName": "Line Warp",
      "url": "https://natemodi.com/logo/line-warp/#v=1&r=1&seed=wkhph6ea&bg=ffffff&fg=111111&lt=VK",
      "embedUrl": "https://natemodi.com/logo/line-warp/#v=1&r=1&seed=wkhph6ea&bg=ffffff&fg=111111&lt=VK",
      "colorsUsed": [
        "#ffffff",
        "#111111",
        "#2563eb"
      ],
      "variationType": "initial-customized",
      "rationale": "Line Warp turns the V/K initials into a compact technical mark while preserving the curated source structure.",
      "bestFor": "agent orchestration, routing, and observability surfaces",
      "tags": [
        "signal-systems",
        "letter",
        "monogram",
        "linear",
        "topographic",
        "systematic"
      ],
      "isRecommended": true,
      "recommendationReason": "Strong silhouette, clear technical fit, and useful contrast as a system seed."
    },
    {
      "id": "vectorkit-005",
      "rank": 5,
      "directionId": "signal-systems",
      "sourceConceptId": "line-warp-0005",
      "sourceUrl": "https://natemodi.com/logo/line-warp/#v=1&r=1&seed=9yl5uton",
      "toolSlug": "line-warp",
      "toolName": "Line Warp",
      "url": "https://natemodi.com/logo/line-warp/#v=1&r=1&seed=9yl5uton&bg=111111&fg=ffffff&lt=VK",
      "embedUrl": "https://natemodi.com/logo/line-warp/#v=1&r=1&seed=9yl5uton&bg=111111&fg=ffffff&lt=VK",
      "colorsUsed": [
        "#111111",
        "#ffffff",
        "#2563eb"
      ],
      "variationType": "initial-customized",
      "rationale": "Line Warp turns the V/K initials into a compact technical mark while preserving the curated source structure.",
      "bestFor": "agent orchestration, routing, and observability surfaces",
      "tags": [
        "signal-systems",
        "letter",
        "monogram",
        "linear",
        "topographic",
        "systematic"
      ],
      "isRecommended": true,
      "recommendationReason": "Strong silhouette, clear technical fit, and useful contrast as a system seed."
    },
    {
      "id": "vectorkit-006",
      "rank": 6,
      "directionId": "letter-marks",
      "sourceConceptId": "brutalist-letters-0001",
      "sourceUrl": "https://natemodi.com/logo/brutalist-letters/#v=1&r=1&seed=mn88l8m3",
      "toolSlug": "brutalist-letters",
      "toolName": "Brutalist Letters",
      "url": "https://natemodi.com/logo/brutalist-letters/#v=1&r=1&seed=mn88l8m3&bg=ffffff&fg=111111",
      "embedUrl": "https://natemodi.com/logo/brutalist-letters/#v=1&r=1&seed=mn88l8m3&bg=ffffff&fg=111111",
      "colorsUsed": [
        "#ffffff",
        "#111111",
        "#2563eb"
      ],
      "variationType": "recolored-curated",
      "rationale": "Brutalist Letters offers a bold high-contrast container that can read clearly as an app icon or favicon.",
      "bestFor": "initial-led identities and social avatars",
      "tags": [
        "letter-marks",
        "letter",
        "monogram",
        "solid",
        "architectural",
        "pictogram"
      ],
      "isRecommended": false
    },
    {
      "id": "vectorkit-007",
      "rank": 7,
      "directionId": "letter-marks",
      "sourceConceptId": "brutalist-letters-0002",
      "sourceUrl": "https://natemodi.com/logo/brutalist-letters/#v=1&r=1&seed=bax8un5k",